,index,text,text_rating,rating
84,113,"Каждый от рождения наделён удачей – кто-то крохами, а кто и через край. Последние бесятся с жиру: испытывая своё немереное везение, устраивают рискованные игры, где на кону дорогие машины, дома, жизни и даже самая удача – как игроков, так и других людей, либо готовых её продать, либо даже не ведающих, что их удача стала ставкой в чьей-то игре. Вот так щёлкнул тебя какой-то урод полароидом, предъявил снимок в качестве ставки и, если проиграл, – вовек тебе удачи не видать, она перейдёт к выигравшему... Ей-богу, в то, что глазастая принцесса, лихо щёлкнув – не полароидом, нет – пальцами, может в мгновение ока воздвигнуть ледовый дворец, верится как-то легче. Да и прынцы в иных мультиках пожизненней здешних игрунов будут. Но не будем придираться... Удачу можно отобрать ещё и прикосновением, что и произошло с одним из двух главгероев, Федерико (как с этим моментом соотносится название фильмы и что оно значит - многажды пояснили в других откликах). Но Федерико (Эусебио Понсела) нашёл молодого везунчика Томаса (Леонардо Сбаралья) и тот играет за двоих, «на пополаме», как говорили когда-то лужниковские торгаши.

Поскольку в так называемых азартных играх какое бы то ни было умение всё равно сведено к нулю, а игра есть процесс выяснения кому сегодня больше повезёт, то и столы с вертушками городить незачем – пипись... простите – удачей можно померяться и без дорогостоящего оборудования. Можно, например, попытаться с завязанными глазами перебежать многополосную автостраду. Или намазать волосы патокой и ждать, на чьё сладкое темечко приземлится какая-то членистоногая дрянь. Ну или совсем уж без изысков: со связанными за спиной руками и традиционно завязанными глазами вскачь нестись по лесу – кто башку о дерево не раскроил, тот и д’Артаньянц.

Подчиняясь неведомо кем составленной турнирной сетке, Томас и Федерико перемещаются по солнечной Испании, не прекращая вялых препирательств – один кокетничает: «а вот уйду», другой томно ответствует: «ну и иди, тебе же хуже». Следует отметить, кстати, что наблюдение за Федерико подталкивает к двум гипотезам. Одна: исполнитель этой роли попросту эмм... неважный актёр. Другая: так задумано. Федерико, надо думать, был до того потрясён принудительным лишением удачи, что ему все лицевые мышцы парализовало. С тех пор бедолага только и может взглядом опечаленной коровы выражать «сей жизни быстротечность». Второе предположение гуманнее, его и будем придерживаться. Томас помоложе и поэнергичнее, особенно если речь заходит о его подруге, но, как писал великий Михал Михалыч Жванецкий, «такой перекос лица ещё не убеждает».

В тягучее, как сырая резина, действо введена детективная интрига: Томас как-то пробовал свои силы в грабеже банков, и теперь неулыбчивая Сара (Моника Лопес) наступает жрецам азарта на пятки. Эти догонялки призваны оживить меланхоличный трип на встречу с чемпионом по везухе, но не оживляют: игруны отдельно,  а гоняющая то за ними, то за тараканами в собственной голове сеньора с пистолетом – отдельно, из-за чего общая картина, и так цельностью не страдающая, становится совсем дробной. То ли лавры г-на Линча режиссёру спать не дают, то ли он просто сырую идею до ума довести поленился... Запутавшись в целях, мотивах, причинах и следствиях, как в айподных наушниках, что месяц в кармане провалялись, постановщик тупо разрубает этот узел финальной перестрелкой а-ля Тарантино, и смотрится эта заплата, как «непришейкобылехвост».

В общем, садись, Фреснадильо, два (по пятибальной шкале) за украденное у меня время.

5 из 10",5 из 10,5
85,115,"Да, после сюрреалистических короткометражек Линч дорос до полноценного полнометражного фильма. Именно 'вырос', так как этот фильм уже на голову выше абсурдных 'Блюющих мужиков' и 'Ампутантки'. Этот фильм снимался то ли четыре, то ли пять лет, в итоге мы получили достаточно качественную работу.

Фильм получился жутким. Здесь еще нет музыки Анджело Бадаламенти, сопровождающей последующие работы Линча, здесь мы слышим различные немелодичные звуки. Особое внимание режиссера к деталям позволяет ему создать свой некий мир. Всё очень мрачно, атмосферно, метафорично.

Хотя здесь и есть основной сюжет (у Генри Спенсера рождается ребёнок-мутант), но действие показано достаточно необычным образом. Очень много непонятных, пугающих и запоминающихся деталей (например, выражение лица отца Мэри за столом я еще не скоро забуду), которые зачастую не поддаются объяснению. Что это было? Зачем это было?

По ходу фильма я сделал для себя некоторые выводы, хотя сумел как-то понять и переварить лишь малую часть показанного. Сомневаюсь, что кто-то сумел понять всё. Кроме разве что самого Линча.

Очень понравилась песенка белокурой 'красавицы'.

Ну и при всём этом теперь скажу, почему я поставил такую низкую оценку фильму, хотя только и делал, что, в общем-то, хвалил его сейчас. Дело не в том, что я очень мало, что понял. Большой и жирный минус фильма - его невозможно смотреть без отвращения. Жуткая атмосфера, детали, звуки, сумбурность и необъяснимость - всё это должным образом пугает, накручивает так, что под конец начинаешь чувствовать тошноту. Скажу честно, до конца досмотреть я не смог, выключил где-то за пять минут до титров. Мне хватило.

Как фильм может быть хорошим, если его невозможно смотреть? Мой итог:

5 из 10",5 из 10,5
86,117,"Как и у всех критиков ленты у меня тоже возникло чувство безысходности, чувство тревоги. Нет, мне не 5 лет и я адекватно отношусь даже, прости господи, к 'Зеленому слонику'. Но этот фильм вызвал некоторое отторжение. Не в плане грязи, а в плане наполнения смыслом. 

  В фильмах Линча я не ищу прямой смысл и хэппи-энды. Это творение также не порадовало срывом покровов. Мне конечно тоже не совсем была понятна тема карандашей и таинственного человека на рычагах. Но главная тема, как бы ее не пытался завуалировать Мастер - выглядит скупо - ответственность за будущее. Ах ну да, субъект типа Генри должен быть джентльменом и не бросать беременную подругу на мороз. Ах как оригинально и непредсказуемо.  

  Не буду разбрасываться только критикой - в фильме есть таки зловещие моменты - особенно в начале - когда камера залетает в какую то дыру, или сцена с бабой-соседкой. Немало лулзов доставила и хохотушка-хомячиха из батареи. 

  Очень странно видеть рейтинг 91%. Маргиналы конечно назовут это творение мейнстримом и типа 'артхаусом', но для меня и лично для меня это будет фильмом для одного просмотра. 

3 из 10",3 из 10,3
87,118,"Мечты - это не обязательно розовые пони и сахарные облака.  В настоящем названии  книги-фильма, как известно, использована цитата из Гамлета: 'What dreams may come'. Перевод Пастернака: 'Какие сны в том смертном сне приснятся,

Когда покров земного чувства снят?' должен был отражать суть фильма. Должен бы, но, к сожалению, отражение вышло как в кривом зеркале, да и зеркало-то разбито. 

 Я не читала романа Мэтисона, но то ли моя вера в преимущество книги перед ее экранизацией так велика, то ли в фильме таки прослеживается Мысль, но полагаю, что в оригинале смысл был. Иначе зачем было размазывать по экрану зрелищные сопли в течении двух часов? 

 Про актеров: Робин Уильямс такой же, как и в других просмотренных мною фильмах с его участием, с глуповато-простодушным лицом, не всегда подходящим к ситуации. Шиорра хороша, но в рамках фильма слишком предсказуема. Дети невыразительны, а девочку я долгое время принимала за мальчика. Странная прическа для маленькой леди из типичной американской семьи.

 Начало было утомительно-идилличным. Первый понравившийся момент, вселивший в меня надежду на смысловое кино - заляпанный в краске герой Уильямса Крис и изречение чернокожего Альберта про то, что реальность есть твое сознание, а материя иллюзорна. Но на этом психоделическая составляющая фильма исчерпана. Периодически режиссер пытался вернуться к этой мысли, но все больше гряз в мелодраматических связях своих героев. Заранее предсказуемый финал, пафосные речи про 'Не сдавайся!' и 'Любовь побеждает!' делали просмотр утомительным. 

 Зрелища наверняка хороши для любителей 'красивенького', масштабны, убедительны, но отвлекают от главной идеи, или даже скорей эту идею меняют. Удачный момент с погрязшими по голову в грязи грешниками, вообще Ад удался Уорду больше. Не тот формат, конечно, кассовым бы фильм не стал, но этот бы сюжет да в духе 'Помутнения' снять. Можно даже и с красками, но менее приторными. Вышло бы глубже и насыщенней, и не было бы после просмотра ощущения подмены и фальши этого розового мирка. 

 Смотреть советую воздушным барышням, истосковавшимся по любви и детям, в возрасте первых духовных познаний. Упрощенная форма системы 'жизнь-любовь-смерть' для категории 12+. 

4 из 10",4 из 10,4
88,123,"Этот фильм не очень смешной. Рейнольдс в главной роли вызывает не смех, а отвращение. Шутки в фильме почти отсутствуют.  Режиссёрская работа почти никакая, остальные актёры играют просто отвратительно.

Этот фильм - типичный трэш того времени. Сейчас он смотрится не менее занудно, чем 30 лет назад.

3 из 10",3 из 10,3
89,125,"Обожаю историю, и как следствие исторические фильмы. К сожалению, данная картина стала одной из худших, которые я когда-либо видел.

Сценарий плох. Скомканность основных действий и растягивание второстепенных просто утомляют. Динамики никакой. Последние 30 минут, откровенно говоря, интерес к фильму пропадает окончательно. По-моему концовку делали с неохотой, просто чтобы как-то закончить фильм. Сцены битв и осад просто убоги. Про них даже сказать почти нечего. Такое чувство, будто сражение, проходило так: собирается толпа галлов орёт на римлян и через 10 минут все мертвы.

С исторической точки зрения фильм тоже оставляет желать лучшего. Осада Аварикума просто поражает. Вместо долгой и изнурительной блокады город выжигается римлянами как по повелению волшебной палочки: раз и вожди уже жалуются Верцингеторигсу. Причем это даже не показывается, галлы просто про это говорят. Предательство эдуев выглядит как спонтанное и необдуманное, хотя на самом деле готовилось долго и тщательно. Арверн Верцингеторигс вдруг становится белловаком. И почему в конце фильма говорится что 'мудрый вождь был казнён через два года' вместо пяти? Про заключение различных договоров и союзов даже не стоит говорить.

Несмотря на это фильм можно было спасти, если бы не актерская игра, хотя правильнее сказать её отсутствие. Грим делает вождей настолько похожими, что порой непонятно кто есть кто. А Клаус Мария Брандауэр в роли вечно ухмыляющегося Цезаря с манией мирового господства просто раздражает. Да и остальные нечем хорошим не выделяются.

Пожалуй, единственным плюсом картины стали костюмы и декорации, которые в большей степени были хорошо подобраны, хотя кольчуги и рогатые шлемы многих галлов оставляют вопросы. 

3 из 10",3 из 10,3
90,126,"Что-то я не разделяю большинства хвалебных искрометных отзывов. Фильм явно скучен и второсортен. За весь фильм я не услышал ни одной смешной шутки, не увидел ни одного поистине интересного эпизода - весь фильм боролся с желанием выключить этот шедевр.

Возможно это оттого, что мне в принципе не нравятся классические комедии, считаю их искусственными, если вы придерживаетесь того же мнения - то фильм вам явно не понравится. 

Всем удачи.

5 из 10",5 из 10,5
