,index,text,text_rating,rating
170,241,"Странно что фильм Майка Фиггиса, так и не снискал особых зрительских симпатий, хотя имел для этого, все предпосылки. 

 Но хотя бы потому, что в фильме играет очень много известных и хороших актёров. Это я сейчас говорю про Денниса Куэйда, который играет абсолютно типичную для себя роль, отца крепкого семейства. А также про Шэрон Стоун, которая наоборот, играет для себя не свойственную роль матери этого крепкого семейства. И ещё наверно стоит отметить Стивена Дорффа, который по понятным причинам исполнит роль негодяя, подлеца и прочего 'редиски'. Ведь отрицательный роли - это его конёк. Есть ещё Джульетт Льюис, а некоторые в первую очередь отмечают Кристен Стюарт, как якобы звезду вселенских масштабов. В общем с таким актёрским составом можно далеко уехать по кинематографической дорожке, но увы, всё подпортил сценарий.

 Сюжет фильма банальный. Семейство из большого города, перебирается в провинцию, где они обживают старый особняк, хранящий много тайн. Но не привидений, не одержимость этого дома злыми духами, зритель не увидит. Всё намного проще. У дома есть бывший хозяин, который в это время возвращается из мест не столь отдалённых, и нанимается к ним делать ремонт. Поначалу он кажется доброжелательным, но потом он решит, что в его бывшем доме, мест для новых жильцов нет. И начнётся небольшое противоборство, его и главы семейства.

 В целом, фильм с большой натяжкой тянет на жанр триллера, и только благодаря агрессивному взгляду Дорффа, и нерешительности Куэйда, создаётся нужная атмосфера. Но сценарий полностью тянет этот фильм на дно, а кульминация сюжета, вовсе подводит слабый итог картине Фиггиса.

 Можно посмотреть разок, актёры у фильма имеются. Но как триллер, фильм можно рассматривать с большой натяжкой.

4,5 из 10",5 из 10,5
171,242,"Примечательно то, что здесь можно увидеть Кристен Стюарт, тут она еще молоденькая совсем, однако талант прорезался и в итоге можно лицезреть достоверную игру. Зря многие ее ругают за без эмоциональность и однотипность мимики, в этом кино полное опровержение этих высказываний.

Почти в начале фильма есть важный момент с аварией, вернее с так и не состоявшейся автоаварией. Меня этот эпизод подтолкнул на размышления и я с ноткой неуверенности подумала о том, что мне хочется верить в том, что каждый родитель готов защитить своего ребенка,  даже тогда, когда казалось бы, что все обошлось. 

В названии фильма много аллегорий. До чего может довести твердолобость людей? Как может взрослая семья решится на покупку дома, где произошло убийство??? Но больше всего меня удивляет, как может взрослый мужчина, когда ему и его семье грозит опасность, продолжать стоять на своем? Любой, нормальный человек не стал бы связываться даже с такой мокрухой и съехал бы как можно быстрее. Поэтому мне не жалко главных героев, что они попали в такое жесткое положение дел. 

Что касается меня, я наверное никогда не смогла бы жить в таком огромном  поместье. Отдохнуть еще возможно, и то перед сном наверняка бы запаслась фонариком, ночниками, кабельным телевидением и желательно шумной компанией, которая засыпала бы только к утру. У меня от таких мест мурашки по коже, огромное количество комнат, в том числе закрытых, там просто обязаны быть приведения или страшные тайны. Так и тут. Поместье «Холодный ручей» поражает своей масштабностью, и даже некоторой зачарованностью, его хочется изведать и убежать подальше одновременно.

Темный и холодный фильм, с элементами жестокости, который оставляет неприятный осадок после просмотра.

6 из 10",6 из 10,6
172,243,"Начало фильма кажется впечатляющим. По морской глади плывет корабль Деметер, чье имя сразу дает понять, что на нем не все чисто, и что имя той «нечисти», что поселила страх и смерть – Дракула. Картинка вполне эффектная, и налицо чувство мистики. Думается, что когда корабль причалит в Лондоне, можно будет ожидать хорошего вампирского действия, но всему довольно быстро приходит печальный конец.

Разочарование – по всем фронтам. Идея поместить действие персонажей, порожденных еще Брэмом Стокером, в наше время, кажется интересной, но она не воплощена должным образом. Ни Дракула, ни профессор Ван Хельсинг в фильме не выглядят убедительно. А наличие кровавых сцен не делает фильм страшным. Этот прием работает лишь в качестве отвращения, а все попытки авторов сделать мистический фильм не приносят результата. Чутья на мистику и сверхъестественные Злые Силы тут нет вообще. И от этого чересчур серьезное лицо главаря вампирского рода вызывает лишь недоумение. Прямо хочется спросить: «Чего такой серьезный?» А главный истребитель вампиров выглядит как беспомощный дядюшка, который по ошибке попал в переплетение серьезных и опасных событий.

Происхождение Дракулы, как первого вампира на свете, в фильме обыграно очень слабо, а та новая версия, что здесь демонстрируется, выглядит лишь как глупость. Изображение вампиров невыразительно как по части актерской игры, так и в области спецэффектов. Окраска лица в белый цвет и вставные зубы. И в отдельных моментах видно, что авторы хотели сработать шире и глубже, но на это просто не хватило воображения. Действие очень нудное, скучное. А вместо мистики и страха – какая-то вялая попытка сделать боевик, но до хитов вроде «Блэйда» - далеко. Результат бледный. 

Излишняя, надуманная серьезность исполнителей главных ролей плохо сочетается с примитивом и недальновидностью сюжетно-смысловых идей, не говоря уже о том, что здесь нет чувства угрозы феномена «вампиризма» для всего человечества. То, что происходит, касается лишь горстки неинтересных персонажей, а что будет со всем миром, если очень неубедительный Дракула решит излить свой гнев, плевать. Неудивительно, что это детище не имело успеха в прокате. Так ему и надо!

3 из 10",3 из 10,3
173,244,"Успех великолепного фильма о пожарных Backdraft 1991 года с Куртом Расселом и Уильямом Болдуином в главных ролях предопределил появление на свет этой пародии. Известно, что в США использование авторских прав в пародии не может рассматриваться как их нарушение.

Поэтому, сюжет этой картины весьма 'извращенным' способом дублирует известную картину, наделяя многие события совсем другим, преимущественно пошлым смыслом. Собственно, именно таким и показался мне этот фильм - неоправданно пошлым и лишенным изящества. И если для порнографического фильма такие характеристики вполне уместны, то для комедии - это просто недопустимо.

Единственная 'фишка' на которую ставят создатели фильма - это участие в картине постаревших звезд в небольших ролях. И действительно, приглашенные актеры стараются выкладываться: Телли Савалас, Шелли Уинтерс и Роберт Митчум очень стараются. Но их участие никак не влияет на уровень фильма.

В итоге: пародия на Backdraft 1991 года с Куртом Расселом в главной роли, несмотря на наличие в фильме известных актеров (Митчум, Уинтерс, Савалас) - фильм мало интересен. Большая часть шуток кажутся плоскими и пошлыми, а неизвестные молодые актеры, которым отведены главные роли играют весьма слабо

3 из 10",3 из 10,3
174,246,"Фильм абсолютно не впечатлил. Красивые и драматические киноистории про любовь мужчин друг к другу есть и не одна: те же «Горбатая гора» и «Полное затмение», к примеру, снятые профессионально, качественно, со вкусом. Но «Последние дни» - явно не тот случай. Главной  причиной неудачи этой картины стало, на мой взгляд метание создателей от одного жанра к другому. Они так и не определились, что, собственно, снимают. Фильм начинается как молодежная комедия, причем сделанная не в лучшей американской традиции, преимущественно с несмешными низкопробными шутками «ниже пояса». Вторая половина фильма пытается стать драмой, соответственно кардинально меняется линия поведения героев, причем мотивы этих перемен никак не объясняются и абсолютно немотивированны. Так и не понятно, почему молодой миссионер-мормон, бывший сначала для Кристиана лишь предметом пари и объектом шуток и приколов, вдруг резко и внезапно /именно что вот так сразу!/ стал любовью всей жизни. Заданные в первой части фильма характеры героев уже не дают возможности поверить их драме и переживаниям впоследствии. И если персонажу Стива Сандерсса можно еще поверить, если постараться, то герою, сыгранному Уэсли А.Рэмси, не веришь совсем.

Из ролей второго плана выделяется разве что Джули, сыгранная Ребекой Джонсон. Все остальные  персонажи ничем особым не запомнились.   

Словом, фильм мог получиться, снимайся он в каком-нибудь одном жанре. Но перевод легкой и бесшабашной комедии в драматический формат обрек картину на неудачу 

Моя оценка фильму

2 из 10",2 из 10,2
175,247,"Первые слова, что пришли на ум: фильм — пустой. После того, как прочитала рецензии кинокритиков (т. к. не отпускало сомнение, так ли я поняла то, что хотел сказать автор) пришли другие слова: фильм недоделанный. Режиссёр абсолютно не смог донести до зрителей свою историю: приходится постоянно и с трудом додумываться, что и кто откуда берётся.

В фильме много моментов, на которых сделан акцент, но не понятно для чего: откуда у младшенькой такой интерес к частной, даже интимной, жизни её старшей сестры и от кого она беременна, почему Кармен стала «такой», откуда у неё такая обида на родителей...

Этот фильм рекламировал себя как шокирующая эротическая драма, а на деле оказался не совсем удачным кино. Смотрела только ради Берналя. И ещё: чтобы фильм был доступней для понимания, видимо стоит знать историю Аргентины.

2 из 10",2 из 10,2
176,248,"Чтож, начнем с того, что слово Hell в названии - это всего лишь фамилия персонажа. После того как я это узнал название приобрело для меня немного другой смысл. До этого  я думал, что это окажется просто тупым боевиком с бесконечными перестрелками, но сюжет немного удивил.

 Он очень даже соответствует трешевым фильмам 80-х годов. После ядерной войны 60% мужчин было убито и правительственной корпорации МедТек нужен мужчина, способный оплодотворить женщину. Именно таким мужчиной оказывается Сэм Хэлл, поэтому его отправляют в город жаб (на розовом форде 40-х годов), где находятся захваченные мутантами девушки, способные родить.  Да, вот такая странная у фильма завязка.

Костюмы жаб сделаны не так уж и плохо по отношению к другим фильмам 80-х. Даже сейчас некоторые фильмы не способны настолько хорошо и антуражно создавать костюмы. Но это совсем не значит, что они идеальны, движения головы и других частей тела иногда выглядят слишком искусственно. Кровь же сама на себя не похожа, местами выглядит как черничный сок, местами как обычная красная краска. Спецэффекты, особенно от взрывов совсем уж неправдоподобны, собственно как и искры от пуль.

Музыка в фильме обычная, а потому, абсолютно не запоминающаяся. Только  во время сцен, где главные герои ехали по пустыне, звучал интересно вставленный мотивчик, нечто, напоминающее вестерны с Клинтом Иствудом. 

 В общем, основной упор в фильме был сделан на красивых представителей женского пола и на сцены с ними. Данный фильм ни коем образом не удивил, да и, наверное, вообще мало кому понравится, потому что таких фильмов слишком уж много было сделано, со странным сюжетом, неизвестными актерами и маленьким бюджетом. Единственное, что мне осталось непонятным  - это откуда у Сэма под конец фильма взялся за спиной самурайский меч?

4 из 10",4 из 10,4
177,250,"Двенадцатилетний мальчик живёт в Копенгагене один с матерью. Как обычно в таком возрасте у него много проблем. Дома он постоянно ругается с мамой, в школе с учителем, а кроме того, у него «большая проблема» - не растут волосы на лобке. И еще одна беда не дает покоя подростку: одноклассница, которая ему нравится, явно неравнодушна  к его лучшему другу. Что остается делать юному герою? Без божественной помощи явно не обойтись…
 
Честно говоря мне фильм не понравился. Довольно странная комедия неизвестно на кого рассчитанная, но очень сильно развращающая. Неужели сейчас такие дети? В двенадцатилетнем возрасте размышляющие, что взять на вечеринку: крепкого пива или ром с колой? Или чего стоит один только эпизод, когда Деннис со спущенными штанами кричит с крыши: 'Эй, Копенгаген, теперь у меня волосы в паху!!!'

Фильм, кроме неприязни и вопроса, зачем я его смотрел, не вызвал ничего. Очень удивляет, что он не имеет ограничений для просмотра, несмотря на  постоянные нецензурные выражения, которые любит употреблять к месту и не к месту главный герой.

2 из 10",2 из 10,2
178,252,"Будучи, очередной раз, в поисках достойного фильма ужасов, наткнулась на 'Дьявольский особняк'. Прочитав описание, что семья переезжает в загородный дом, ожидала увидеть что-то наподобие 'Ужаса Амитивилля', но была очень разочарована.

Во - первых, фильм просто невероятно скучный. На протяжении  всего фильма ожидала, когда же станет интересно. Очень затянутое начало и скомканный конец. 3/4 фильма прошли в ожидании хоть чего-нибудь пугающего.

Во-вторых, это не ужасы. Триллер...возможно, но не слишком хороший, потому что, повторюсь, чувства тревоги и волнения пришлось очень долго ждать и длилось оно совсем недолго. 

В-третьих, игра актеров. Вот это единственное, что, на мой взгляд, заслуживает положительной оценки. Шэрон Стоун и юная Кристен Стюарт бесподобны; Стивен Дорфф великолепен; а вот Деннис Куэйд не слишком порадовал, некоторые сцены кажутся слишком наигранными и неестественными.

5 из 10",5 из 10,5
