,index,text,text_rating,rating
255,361,"Как то с подругами обсуждали какой самый страшный фильм ужасов мы когда-либо видели. Одна из них назвала 'Ребенок Розмари' и сказала, что в жизни ничего страшнее не видела, самое страшное - это финальная сцена, в которой героиня заходит в гостиную. Естественно, мне тоже захотелось посмотреть это кино, причем возможность выпала только через пару лет. Я выбрала время, чтобы меня никто не отвлекал, выключила свет, настроилась на шедевр и. .. ничего. 

   Во-первых, весь фильм сильно раздражала бестолковость главной героини. Имея столько племянников, она не знала как должна проходить нормальная беременность и что при этом надо делать. Сначала я подумала, что у нее просто нет подруг, но на вечеринке было показано много людей молодых, современных и вполне адекватных, которые сразу дали ей здравый совет. Как можно пить вместо витаминов какую-то отраву, не зная ее состава, да еще из рук абсолютно чужого человека, к которому испытываешь стойкую неприязнь? Или как может беременная женщина носить 'на удачу' кулон, снятый с трупа, который она сама видела? Выросшая в католической семье, она ни разу не сходила в храм, даже когда подозревала, что соседи проводят черные мессы. На мой взгляд - это полный бред.

   В общем, никакого страха я не испытывала - только недоумение. Не почувствовала ни атмосферы, ни нарастающего напряжения, хотя очень ждала. Единственное страшное в этом фильме - это колыбельная, от нее действительно морозец по коже прошел.

   Актерская игра мне понравилась, образы получились яркими, запоминающимися. Но на этом, к сожалению, всё. Самое обидное, что я не отношусь к любителям рек крови или изобилия спецэффектов, множества трупов. Наоборот, мне нравятся старые книги и фильмы, где действие происходит вокруг всего 1 трупа или происшествия, в отличие от современных, где мучают и убивают каждые 10 минут.  

   В итоге, фильм совсем не понравился - такого разочарования я уже давно не испытывала. Не буду его рекомендовать друзьям и не буду его пересматривать. 

3 из 10",3 из 10,3
256,362,"Небольшое отступление, посвящённое моему отношению к мультипликации в кино. На рубеже 80-90-х гг. в кинематографе была впервые применена методика комбинации игрового кино и мультипликации. Примером жанра принято считать картину Роберта Земекиса «Кто подставил кролика Роджера», ставшую одной из самых кассовых за всю историю американского кино. Тем не менее, совмещение мультфильма и нормального кино я продолжаю считать делом чрезвычайно узкой направленности. Вряд ли можно выжать из этого жанра сколько-нибудь серьёзное произведение, способное на равных конкурировать с обычным кино.

Возможно, успех Земекиса и «Кто подставил кролика Роджера» подтолкнул Ральфа Бакши сделать картину в схожем стиле. Вообще-то к 1992 году Бакши и сам уже слыл именитым постановщиком, чьи далеко недетские по содержанию работы успели стать культовыми в определённых кругах. «Параллельный мир» (также существуют названия «Крутой мир» или «Клёвый мир») с «Кто подставил кролика Роджера» сравнивать не совсем корректно. Общего у них мало. Но почему-то продолжают сравнивать. Наверное, потому что в направлении кино+мультик снято совсем немного. Конечно, «Параллельный мир» - это тоже несерьёзно.

В центре сюжета Фрэнк Харрис - бывший солдат, вернувшийся с войны. Неудачи продолжают преследовать Фрэнка и в мирное время. После аварии, в которой погибает его мать, а он (вероятно) получает серьёзную травму мозга, реальность теряет для него всякую привлекательность. И тогда он попадает в нарисованный мир (или выдумывает его?), где становится крутым детективом. Задача Фрэнка - оберегать жителей параллельного мира от контактов с реальными людьми.

А бывший заключенный Джек Дибс постоянно видит образы из этого самого параллельного мира. Зарисовывая свои видения, он по уши влюбляется в сексапильное создание Холли Вуд. Сделать из нарисованной красотки настоящую можно только одним способом... Занявшись с ней сексом. 

Концептуально! Новое слово в жанре! Ах, если бы вы слышали, с какой иронией я произношу эти слова. Собственно, на сексе человека с мультяшкой и завязан весь сюжет. Никому до Ральфа Бакши не приходило в голову что-то подобное снять, и тем более сделать это в рамках рейтинга PG-13. Но! Любители клубнички - остыньте. Самое интересное, к сожалению, останется за кадром. Самим фактом хы... приходится довольствоваться. Для начала неплохо.

В фильме есть действительно смешные моменты - и в основном это анимированные сцены. Юмор не то чтобы чёрный, но довольно взрослый. Очень повеселила сцена падения какого-то фиолетового уродца с небоскрёба, когда камера будто бы пролетала через его внутренности. Вообще, на переднем плане весь фильм творится что-то невообразимое, возможное только по законам мультипликации. Расплющенные мультяшки или стрельба друг в друга из пушки - здесь дело обычное. Градус шуток не так высок, как хотелось бы, зато некоторые бьют очень метко. Интересно, почти что сюрреалистически реализованы перемещения героев между трёхмерным и двухмерным измерениями.

Хорошо подобрана музыка. Бакши в выборе песен к своим фильмам не ошибается. Приятно было услышать песни Дэвида Боуи, Моби и Брайана Ино. Марк Ишам, написал несколько удачных композиций. Приманкой для зрителя послужит и звёздный актёрский состав: ещё молодой и зелёный Брэд Питт, не по-мультяшному обаятельный и серьёзный Гэбриел Бирн, и, самое главное - сексуальная Ким Бейсингер представшая в образе а-ля Мэрилин Монро. И всё-таки настоящая Ким приглянулась мне куда больше, чем её нарисованная копия.

Долгое время анимацию было принято считать традиционно «детским» видом искусства. Ральф Бакши был одним из первых, кто совместил анимацию с игровым фильмом, приправив это дело эротикой. И даже сейчас, несмотря на то что в техническом плане лента безнадёжно устарела и вряд ли кто-то в будущем предпримет попытку снять что-то подобное (где будут соседствовать трёхмерные и двухмерные персонажи), «Cool World» всё равно смотрится интересно и увлекательно, и это заставляет относиться к нему по крайней мере уважительно. 

Как мультик для взрослых «Параллельный мир» недостаточно жёсток. Лёгкая эротика не лишает фильм прочих минусов. Работе Ральфа Бакши не достаёт столь мною любимой брутальности, безбашенности а, может быть и ненормативной лексики - одним словом фильм не в полной мере оправдывает возложенные на него ожидания. Вот если бы существовала необрезанная режиссёрская версия...

7,5 из 10",5 из 10,5
257,363,"Будущее глазами американских режиссеров почти всегда выглядит одинаково – толпы людей, бесцельно бродящих по улице, мрак (куда делось Солнце???), серые строения непригодные для жизни, разброд и анархия. В фильме «Вавилон н.э.» создатели продвинулись еще немного вперед, показав, как будет жить не только их страна, но и другие страны – перебрали все, что смогли в пределах 100 минут. 

Итак, дело начинается…
…в Сербии. Город, дома, но люди видимо живут на улице – они уставлены палатками, горят костры. Царит хаос и жестокость. Но самое интересное то, что народ здесь говорит по-русски. И Вин Дизель, заучив несколько фраз, коряво, но с претензией на небрежность бросает их в эфир. 

Чуть позже место действия переносится ….
…в Монголию. От нее в будущем, похоже, останется только небольшой островок земли над пропастью, где прямо в скале расположится женский монастырь, в котором живут исключительно образованные дамы. Забрав груз в виде двух красавиц главный герой отправляется в…
…в Казахстан. И вот тут мне уже захотелось закричать. Будущее моей страны представили так – бездумная толпа ползет по улице, в клетках заперты тигры-клоны, кому-то прилаживают протез, подвешен труп кошки. Люди явно не здоровы (ни физически, ни морально!). Из всех благ современной и развитой в будущем жизни – огромный светодиодный экран и поезд нового поколения. Люди, словно забитые собаки, с глазами полными ужаса с мольбой смотрят на главного героя, который спокойно минует любые посты, хватает одежду с прилавков и прорывается в поезд, не задумываясь о таких мелочах как оплата. 
И отправляется…
…в Россию. Владивосток превратился в громадный лагерь для беженцев, где они выстроили для себя что-то наподобие строительных лесов с бесконечными площадками, лестницами и переходами. Каждый второй похож на опасного уголовника-рецидивиста и в то же время само действо напоминает дискотеку – неяркий свет, музыка, тусовщики. Слышна русская речь, но…наш главный герой вдруг забывает ее и говорит только по-английски!!! 

Далее по ходу фильма разговор заходит…
…об Узбекистане. По предположению авторов фильма к тому времени в Узбекистане пройдет бактериологическая война, все люди будут заражены непонятной болезнью и народ сотрет с лица земли. 

А наши герои тем временем добираются …
…до Канады. Тут конечно все на порядок лучше. Та же толпа, но одета приличнее, люди на вид здоровы и благополучны. Суперсовременный аэропорт и Дизель со своим грузом перелетает в…
…в Нью-Йорк. И вот она, цитадель спокойствия и радости! Америка, раем была, раем останется! Тут уже просто не остается слов и не хочется вслед за режиссером петь дифирамбы дорогим их сердцу США! 

В итоге.

А в результате я пришла только к одному мнению – создатели так перемудрили с сюжетом, что просто угробили картину, из которой, кстати, могло выйти нечто вполне пригодное для просмотра, возможно и неоднократного. Перемудрили со всем – с языками, с эффектами (БУМАЖНАЯ карта с возможностью навигации…не впечатляет!), с представлением действительности, которая ожидает страны Евразии в будущем. Перемудрили и с образом главного героя – 90-ые прошли и отъявленные злодеи, объявленные в международный розыск как террористы, но, тем не менее, с мягким сердцем и большой душой должны остаться там же! Это тогда, мы, изголодавшиеся хоть по какому-нибудь кинематографу, могли смотреть что угодно, да еще и верить в это! Еще больше перемудрили с непорочным зачатием главной героини – ребята… это другая история! И вот, окончательную пулю в висок фильма выпускает ее фраза «Теперь ты отец этих детей!». 

Не спас фильм и Вин Дизель. В «Лысом няньке» и даже в «хХх» он смотрится куда как более гармонично. Хотя неудачный сюжет и, неудачную в целом работу, не смог бы вытянуть в одиночку даже самый талантливейший из актеров, к коим Дизеля отнести никак нельзя. Ну да, Вин, это посложнее чем в одиночку спасать мир! 

3 из 10",3 из 10,3
258,364,"Или даже отсутствующая.

Мультфильм, конечно, любопытно нарисован - все эти удлиненные, стилизованные формы... сочные краски... но с логикой сюжета что-то случилось. Удивительно, что исходная сказка была вполне логична - из каких соображений Пеннер и компания все поменяли?

Как известно, злая фея прокляла девушку и сказала, что в день семнадцатилетия она уколется веретеном и умрет.

После этого ее изымают из родительского дома во младенчестве три странные феи. Логика? До семнадцати лет у дитяти практически индульгенция. В исходной сказке проблему пытались решить, изничтожив все веретена в госудерстве - тоже не блистательная мысль, но хотя бы логичная. По-хорошему, вообще-то, следовало конкретно в день перед семнадцатым днем рождения посадить девушку под замок под присмотром мамы и пары солдат. И так до следующего дня. Объяснив, ей, естественно, предварительно, что ее может ждать в противном случае.

Ближе к концу сказки нам сообщают дополнительные детали - злодейка, оказывается, не ограничилась пророчеством, она зачем-то все эти годы искала принцессу. Зачем? Ей было настолько нечем заняться? Ну убила бы ее сразу, что же так мучиться. Или уж ждала бы исполнения своего проклятия. Нет, искала, причем, чтобы она ее не нашла, феи-опекунши перестали пользоваться магией.

Внимание, вопрос: а как они без магии, ничего вообще по хозяйству не умея, вырастили ребенка? Кто ее кормил? Феи не умеют готовить вообще, как мы видим в сцене приготовления к празднику. Они это впервые пробуют через семнадцать лет после взятия девочки на воспитание! Просто гениально. Кто сшил ей это деревенское платье, в котором принцесса бегает по лесам? Они не умеют шить, как мы видим это в той же сцене. Где именно прячут принцессу, не знают даже ее родители, так что гуманитарная помощь исключается. Чудеса в решете. А уж какую Маугли они воспитали... как она потом сможет в обществе адаптироваться? Она же только со зверями общалась, бедная. А ей все же быть первой леди государства предстоит.

Ну, в общем, понятно, зачем принцесу изолировали от общества - чтобы она этак нечаянно встретилась с суженым. В угоду этой примитивной романтике наворотили несуразностей.

И все ведь зазря! Именно в ключевой день, когда вообще нужно было в оба следить, феи решили тряхнуть стариной и поколдовать, девчонка под гипнозом укололась веретеном...

Любовная линия удручает не меньше. Она видела его во сне, она встретила его в лесу... это, конечно, повод связать с человеком свою жизнь, да. Но тут нельзя упрекнуть студию Дисней - подобным подходом к браку и любовным отношениям славятся многие сказки.

Можно, конечно, сказать 'это же сказка' или 'это же для детей'. Но 'Алладин', например, тоже для детей. И хотя там все достаточно наивно, и, конечно, нереалистично, но логично - внутри игрового пространства, во вселенной того произведения - логично. Мотивы действий всех персонажей ясны и понятны. Чем провинилась 'Спящая красавица'?

5 из 10",5 из 10,5
